{
  "verdict": "PASS",
  "stop_reason": "goal_met",
  "summary": "Phase 3 closeout verified. All 6 Phase 3 checker reports have verdict=PASS. Verification script scripts/verify-phase3-closeout.ps1 passes all checks with exit code 0. npm test passes 139/139 tests. npm run typecheck is clean. npm run build succeeds for renderer, main, and preload bundles. No forbidden external plugin, backend, notification, upload, or cloud features detected. The closeout itself added no new product behavior; it only validates and reports prior work.",
  "evidence": [
    "scripts/verify-phase3-closeout.ps1 passed=true",
    "loop/reports/phase-3-closeout.md exists and documents all accepted slices",
    "loop/reports/phase-3-checker.json verdict=PASS",
    "loop/reports/phase-3-deferred2-checker.json verdict=PASS",
    "loop/reports/phase-3-deferred3-checker.json verdict=PASS",
    "loop/reports/phase-3-deferred4-checker.json verdict=PASS",
    "loop/reports/phase-3-deferred5-checker.json verdict=PASS",
    "loop/reports/phase-3-deferred6-checker.json verdict=PASS",
    "npm test: 139/139 tests pass, 0 fail",
    "npm run typecheck passes",
    "npm run build passes for renderer, main, and preload bundles",
    "Forbidden files absent: externalPlugins.ts, pluginLoader.ts, backend.ts, notifications.ts"
  ],
  "blocking_issues": [],
  "phase_scope_violations": [],
  "manual_verification_required": [
    "All Phase 3 user-facing features work together in the running Electron app",
    "No external plugin loading, backend, notification, upload, or cloud behavior is present",
    "Phase 3 backlog is closed and no next slice starts automatically"
  ],
  "next_maker_instruction": "Phase 3 is fully closed. Await human manual gate confirmation before exiting the loop."
}
