{
  "verdict": "PASS",
  "stop_reason": "goal_met",
  "summary": "Phase 2 Deferred Slice 3 implements the authorized local pixelator slice: a deterministic pixelateImage function in src/shared/imagePixelator.ts with unit tests for block averaging, non-divisible dimensions, palette quantization, immutability, and invalid input. The verification script passes, forbidden features are absent, and an acceptance report exists.",
  "evidence": [
    "scripts/verify-phase2-deferred3.ps1 exits 0 with all checks passed.",
    "npm test passes all 98 tests across 17 suites, including 5 pixelator tests.",
    "npm run build succeeds for renderer, main, and preload Vite targets.",
    "npm run typecheck succeeds after adding a local Electron CSS property type for WebkitAppRegion.",
    "src/shared/imagePixelator.ts exists as a pure deterministic module with no DOM, timers, or side effects.",
    "src/shared/imagePixelator.test.ts covers block averaging, partial edge blocks, palette quantization, immutability, and invalid input validation.",
    "loop/reports/phase-2-deferred3-acceptance.md documents scope, files, test results, and forbidden features not implemented.",
    "Forbidden files are absent: customCharacterManager.ts, startupLaunch.ts, hotkeys.ts, pluginActions.ts, backend.ts, notifications.ts.",
    "No file upload UI was added to src/App.tsx."
  ],
  "blocking_issues": [],
  "phase_scope_violations": [],
  "manual_verification_required": [
    "Local RGBA input can be converted to pixel-art output.",
    "Palette quantization behaves as expected.",
    "No file upload UI, remote upload, backend, or character manager behavior is present."
  ],
  "next_maker_instruction": "No further maker iteration is needed for Phase 2 Deferred Slice 3. Await human approval before starting the next deferred slice or Phase 3."
}
